codigo;sexo;edad;nombre;apellidos;direccion
A001901;Masculino;40;Alberto;Marín Torres;15, Carrer d'Alfons Moré, Salt, Gironès, Girona, Catalunya, 17190, España
A001902;Femenino;26;Irene;Castro Abellán;9, Carrer de Valladolid, Eixample, Girona, Gironès, Girona, Catalunya, 17005, España
A001903;Femenino;29;María Teresa;Belen Cruz;4, Carrer de Josep Pla, Salt, Gironès, Girona, Catalunya, 17190, España
A001904;Masculino;27;Ramón;Sánchez Acebes;Carrer de les Hortènsies, Olot, España
A001905;Masculino;45;Ricardo;Romero Matos;Carrer del Serpent, Nou, Manlleu, Osona, Barcelona, Catalunya, 08560, España
A001906;Masculino;28;Javier;Alonso Martínez;95, Carrer de Floridablanca, Sant Antoni, Eixample, Barcelona, Barcelonès, Barcelona, Catalunya, 08001, España
A001907;Femenino;30;Carmen;Gómez Lucas;105, Carrer d'Aragó, la Nova Esquerra de l'Eixample, Eixample, Barcelona, Barcelonès, Barcelona, Catalunya, 08001, España
A001908;Masculino;35;Jordi;Clos Pou;Teatre Grec, Barcelona, España
A001909;Femenino;24;Anna;Batalla Lata;2B, Carrer de Simó Oller, el Gòtic, Ciutat Vella, Barcelona, Barcelonès, Barcelona, Catalunya, 08002, España
